{
  "$schema": "../schemas/action.schema.json",
  "schemaVersion": "1.0",
  "key": "auth.action.passkey.create-durable-user",
  "name": "Create Durable User from Passkey Proof",
  "summary": "Creates one durable user only after a PendingIdentity contains validated passkey proof and identity-resolution policy permits creation.",
  "version": 1,
  "maturity": "proposed",
  "requiredInputs": [{ "key": "pending-identity-reference", "valueType": "reference", "required": true, "description": "Passkey PendingIdentity approved for new-user creation." }],
  "guards": [{ "expression": "pending-identity-status == resolution-required and credential-proof == passkey-proved and no existing canonical identity matches", "failureCode": "passkey-user-creation-not-permitted" }],
  "permittedMutations": ["durable-identity", "account-status", "home-workspace"],
  "requiredEffects": ["create-one-durable-user", "record-passkey-user-creation", "mark-home-workspace-required"],
  "forbiddenEffects": ["create-home-workspace", "bind-unvalidated-credential", "establish-normal-session", "create-duplicate-user"],
  "invariantKeys": ["auth.invariant.identity-resolution.no-duplicate-user", "auth.invariant.pending-identity.no-normal-authorization", "auth.invariant.transition.one-state-changing-action", "auth.invariant.transition.deterministic-post-state"],
  "sourceReferences": [{ "sourceType": "code", "reference": "src/LagoVista.AspNetCore.Identity/Managers/AppUserPasskeyManager.cs", "note": "CompletePasswordlessRegistrationAsync currently creates AppUser during attestation completion; this action separates that mutation" }, { "sourceType": "discussion", "reference": "AUTH-MODEL-GUIDE.md", "section": "4.8" }]
}