{
  "$schema": "../schemas/action.schema.json",
  "schemaVersion": "1.0",
  "key": "auth.action.external-idp.link-current-user",
  "name": "Link External Provider to Current User",
  "summary": "Associates a validated, unlinked external provider subject with the currently authenticated durable user.",
  "version": 1,
  "maturity": "proposed",
  "requiredInputs": [
    { "key": "provider", "valueType": "string", "required": true },
    { "key": "provider-subject", "valueType": "string", "required": true },
    { "key": "current-user-reference", "valueType": "reference", "required": true }
  ],
  "guards": [
    { "expression": "session-capability == authenticated-normal", "failureCode": "authenticated-user-required" },
    { "expression": "target durable identity is the current authenticated user", "failureCode": "provider-link-target-mismatch" },
    { "expression": "provider subject is not linked to another durable identity", "failureCode": "provider-subject-already-linked" }
  ],
  "permittedMutations": [],
  "requiredEffects": ["atomically-create-provider-link", "record-provider-link"],
  "forbiddenEffects": ["create-durable-user", "switch-durable-identity", "resolve-user-by-provider-email"],
  "invariantKeys": ["auth.invariant.identity-resolution.no-duplicate-user", "auth.invariant.email-identities.not-conflated"],
  "sourceReferences": [
    { "sourceType": "decision", "reference": "User Authentication", "note": "Approved policy requires provider-subject-first resolution and independent NuvIoT email proof before linking an unlinked provider to an existing durable user." },
    { "sourceType": "code", "reference": "src/LagoVista.UserAdmin.Models/Users/PendingIdentity.cs", "note": "PendingIdentity defines OAuthExternalLogin as a ceremony-only flow bucket." },
    { "sourceType": "decision", "reference": "ChatGPT conversation 2026-08-20", "note": "External IdP V2 reconciliation retains provider protocols as implementation details beneath provider-independent auth semantics." },
    { "sourceType": "code", "reference": "src/LagoVista.UserAdmin/Managers/AppUserManager.cs", "note": "AssociateExternalLoginAsync enforces target user id equals acting user id." }
  ]
}
