{
  "$schema": "../schemas/action.schema.json",
  "schemaVersion": "1.0",
  "key": "auth.action.pending-identity.cancel",
  "name": "Cancel Pending Identity",
  "summary": "Terminates an active identity ceremony at the user's or system's explicit request.",
  "version": 1,
  "maturity": "proposed",
  "requiredInputs": [{ "key": "cancellation-reason", "valueType": "string", "required": true }],
  "guards": [{ "expression": "pending-identity-status in [pending,verification-required,verifying,resolution-required]", "failureCode": "pending-identity-not-active" }],
  "permittedMutations": ["auth.dimension.pending-identity-status", "auth.dimension.pending-identity-flow", "auth.dimension.session-capability"],
  "requiredEffects": ["invalidate-pending-identity-secrets", "record-pending-identity-canceled"],
  "forbiddenEffects": ["resolve-durable-identity", "grant-normal-application-authorization"],
  "invariantKeys": ["auth.invariant.pending-identity.no-normal-authorization", "auth.invariant.transition.deterministic-post-state"],
  "sourceReferences": [{ "sourceType": "discussion", "reference": "AUTH-MODEL-GUIDE.md", "section": "4.5" }]
}