{
  "$schema": "../schemas/action.schema.json",
  "schemaVersion": "1.0",
  "key": "auth.action.totp-sign-in.submit",
  "name": "Submit TOTP Sign-In",
  "summary": "Attempts TOTP authentication for an already identified durable account and establishes an authenticated session only when the one-time code is accepted.",
  "version": 1,
  "maturity": "proposed",
  "requiredInputs": [
    { "key": "email", "valueType": "string", "required": true, "description": "Previously identified account email used to resolve the durable identity." },
    { "key": "verification-code", "valueType": "secret-reference", "required": true, "description": "Current time-based one-time code generated by the enrolled authenticator." }
  ],
  "guards": [
    { "expression": "session-capability == anonymous", "failureCode": "totp-sign-in-requires-anonymous-session" }
  ],
  "permittedMutations": ["auth.dimension.credential-proof", "auth.dimension.session-capability"],
  "requiredEffects": ["resolve-existing-identity", "verify-totp-proof", "record-totp-authentication-attempt"],
  "forbiddenEffects": ["create-durable-user", "change-password-credential", "disclose-account-existence"],
  "invariantKeys": ["auth.invariant.transition.one-state-changing-action", "auth.invariant.transition.deterministic-post-state"],
  "sourceReferences": [
    { "sourceType": "code", "reference": "src/LagoVista.UserAdmin/Managers/AppUserMfaManager.cs", "note": "VerifyTotpAsync contains the reusable TOTP proof validation but currently accepts a resolved userId rather than anonymous email identity." },
    { "sourceType": "code", "reference": "softwarelogistics/nuviot-ui-shared:user/continue-totp/continue-totp.component.ts", "note": "Canonical web surface exists, but verify() is currently a TODO and does not invoke a server operation." }
  ]
}